{
  "id": "estandartes:weapon/daga",
  "name": "Daga",
  "family": "Blade",
  "damageType": "Pierce",
  "baseDamage": 24,
  "penetration": 0.3,
  "range": 0.4,
  "effectiveRange": 0.4,
  "windup": 0.25,
  "strike": 0.1,
  "recover": 0.25,
  "staminaCost": 5,
  "ammo": 0,
  "reload": 0,
  "ranged": false
}
