{
  "id": "estandartes:weapon/arco_corto",
  "name": "Arco corto",
  "family": "Bow",
  "damageType": "Pierce",
  "baseDamage": 35,
  "penetration": 0.15,
  "range": 150,
  "effectiveRange": 90,
  "windup": 0.9,
  "strike": 0.05,
  "recover": 0.3,
  "staminaCost": 6,
  "ammo": 24,
  "reload": 0,
  "ranged": true
}
