{
  "id": "estandartes:weapon/hacha_danesa",
  "name": "Hacha danesa",
  "family": "Polearm",
  "damageType": "Cut",
  "baseDamage": 70,
  "penetration": 0.3,
  "range": 1.6,
  "effectiveRange": 1.6,
  "windup": 0.8,
  "strike": 0.18,
  "recover": 0.6,
  "staminaCost": 18,
  "ammo": 0,
  "reload": 0,
  "ranged": false
}
