{
  "id": "estandartes:weapon/espada_corta",
  "name": "Espada corta",
  "family": "Blade",
  "damageType": "Cut",
  "baseDamage": 32,
  "penetration": 0.1,
  "range": 0.8,
  "effectiveRange": 0.8,
  "windup": 0.35,
  "strike": 0.12,
  "recover": 0.3,
  "staminaCost": 7,
  "ammo": 0,
  "reload": 0,
  "ranged": false
}
