{
  "id": "estandartes:weapon/lanza_caballeria",
  "name": "Lanza de caballería",
  "family": "Polearm",
  "damageType": "Pierce",
  "baseDamage": 60,
  "penetration": 0.4,
  "range": 3.0,
  "effectiveRange": 3.0,
  "windup": 0.3,
  "strike": 0.12,
  "recover": 0.8,
  "staminaCost": 6,
  "ammo": 0,
  "reload": 0,
  "ranged": false
}
