{
  "id": "estandartes:weapon/espada",
  "name": "Espada",
  "family": "Blade",
  "damageType": "Cut",
  "baseDamage": 40,
  "penetration": 0.15,
  "range": 1.0,
  "effectiveRange": 1.0,
  "windup": 0.45,
  "strike": 0.15,
  "recover": 0.35,
  "staminaCost": 9,
  "ammo": 0,
  "reload": 0,
  "ranged": false
}
