{
  "id": "estandartes:weapon/pica",
  "name": "Pica",
  "family": "Polearm",
  "damageType": "Pierce",
  "baseDamage": 45,
  "penetration": 0.3,
  "range": 5.0,
  "effectiveRange": 5.0,
  "windup": 0.6,
  "strike": 0.16,
  "recover": 0.55,
  "staminaCost": 10,
  "ammo": 0,
  "reload": 0,
  "ranged": false
}
