{
  "id": "estandartes:weapon/lanza_ligera",
  "name": "Lanza ligera",
  "family": "Polearm",
  "damageType": "Pierce",
  "baseDamage": 36,
  "penetration": 0.2,
  "range": 2.5,
  "effectiveRange": 2.5,
  "windup": 0.35,
  "strike": 0.12,
  "recover": 0.4,
  "staminaCost": 7,
  "ammo": 0,
  "reload": 0,
  "ranged": false
}
